{
  "$schema": "https://json-schema.org/draft/2020-12/schema",
  "$id": "https://llm-collab.dev/schemas/standalone/v1/session-ref.schema.json",
  "title": "SessionRefV1",
  "description": "An exact native session binding. Display text, path inference, activation packets, leases, and writer claims confer no SessionRef authority.",
  "type": "object",
  "additionalProperties": false,
  "required": ["schema_version", "workspace_id", "scope", "session_ref_id", "endpoint_id", "native_session_id", "repository_binding", "evidence"],
  "properties": {
    "schema_version": {"const": 1},
    "workspace_id": {"$ref": "#/$defs/workspaceId"},
    "scope": {"$ref": "#/$defs/scope"},
    "session_ref_id": {"type": "string", "pattern": "^(?!.*[\\u0000-\\u001f\\u007f\\u0085\\u2028\\u2029])session_[A-Za-z0-9][A-Za-z0-9_-]{2,127}$"},
    "endpoint_id": {"type": "string", "pattern": "^(?!.*[\\u0000-\\u001f\\u007f\\u0085\\u2028\\u2029])endpoint_[A-Za-z0-9][A-Za-z0-9_-]{2,127}$"},
    "native_session_id": {"type": "string", "minLength": 1, "maxLength": 512, "pattern": "^(?!.*[\\u0000-\\u001f\\u007f\\u0085\\u2028\\u2029]).+$"},
    "repository_binding": {"$ref": "#/$defs/repositoryBinding"},
    "evidence": {"$ref": "https://llm-collab.dev/schemas/standalone/v1/state-evidence.schema.json"},
    "extensions": {"$ref": "#/$defs/extensions"}
  },
  "allOf": [
    {
      "properties": {
        "evidence": {
          "properties": {
            "evidence_kind": {"const": "exact_session_binding"},
            "quality": {"const": "authoritative"}
          }
        }
      }
    }
  ],
  "$defs": {
    "token": {"type": "string", "pattern": "^(?!.*[\\u0000-\\u001f\\u007f\\u0085\\u2028\\u2029])[A-Za-z][A-Za-z0-9._-]{0,127}$"},
    "workspaceId": {"type": "string", "pattern": "^(?!.*[\\u0000-\\u001f\\u007f\\u0085\\u2028\\u2029])ws_[A-Za-z0-9][A-Za-z0-9_-]{2,127}$"},
    "canonicalPath": {
      "type": "string",
      "minLength": 2,
      "maxLength": 4096,
      "pattern": "^/(?!/)(?!.*//)(?!.*(?:/\\.{1,2})(?:/|$))(?!.*[\\u0000-\\u001f\\u007f\\u0085\\u2028\\u2029])[^/](?:.*[^/])?$"
    },
    "repositoryBinding": {
      "type": "object",
      "additionalProperties": false,
      "required": ["project_id", "repo_id", "canonical_cwd"],
      "properties": {
        "project_id": {"$ref": "#/$defs/token"},
        "repo_id": {"$ref": "#/$defs/token"},
        "canonical_cwd": {"$ref": "#/$defs/canonicalPath"}
      }
    },
    "scope": {
      "type": "object",
      "additionalProperties": false,
      "required": ["kind"],
      "properties": {"kind": {"enum": ["workspace", "project"]}, "project_id": {"$ref": "#/$defs/token"}},
      "allOf": [{"if": {"properties": {"kind": {"const": "project"}}, "required": ["kind"]}, "then": {"required": ["project_id"]}, "else": {"not": {"required": ["project_id"]}}}]
    },
    "extensions": {
      "description": "Bounded non-authoritative annotations. Consumers must ignore these values for routing, trust, and execution.",
      "type": "object",
      "maxProperties": 8,
      "propertyNames": {"pattern": "^x_note_[A-Za-z][A-Za-z0-9_-]{0,55}$"},
      "additionalProperties": {
        "anyOf": [
          {"type": "string", "maxLength": 512, "pattern": "^(?!.*[\\u0000-\\u001f\\u007f\\u0085\\u2028\\u2029\\ud800-\\udfff]).*$"},
          {"type": "integer", "minimum": -9007199254740991, "maximum": 9007199254740991},
          {"type": "boolean"},
          {"type": "null"}
        ]
      }
    }
  }
}
