{"schema_version":1,"workspace_id":"ws_alpha","scope":{"kind":"project","project_id":"proj"},"session_ref_id":"session_one","endpoint_id":"endpoint_one","native_session_id":"native_123","repository_binding":{"project_id":"proj","repo_id":"app","canonical_cwd":"/work/app"},"evidence":{"source":"adapter","quality":"authoritative","adapter_revision":"r1","correlation_id":"c1","observed_at_utc":"2026-07-19T00:00:00Z","integrity":"sha256:aaaaaaaaaaaaaaaaaaaaaaaaaaaaaaaaaaaaaaaaaaaaaaaaaaaaaaaaaaaaaaaa"}}
